ISBN13,Title,Provider,Country,Price,Scanned_Page
9788087073292,"Great villas of Bohemia, Moravia and Silesia",Cotswold Internet Books,Vereinigtes Königreich,102.5,4
9788425339783,1001 Discos Que Hay Que Escuchar Antes de Morir / 1001 Albums You Must Hear Before You Die (Spanish Edition),Iridium_Books,Spanien,119.0,4
9788425341816,1001 discos que hay que escuchar antes de morir/ 1001 Albums You Most Hear Before You Die (Spanish Edition),Iridium_Books,Spanien,349.0,4
9788425343308,1001 discos que hay que eschucar antes de morir/ 1001 Albums You Must Hear Before You Die (Spanish Edition),Iridium_Books,Spanien,575.96,4
9788425350887,1001 discos que hay que escuchar antes de morir / 1001 Albums You Must Hear Before You Die (Spanish Edition),Iridium_Books,Spanien,349.0,4
9788896527009,Lucca Encounters the World,Bookbot,Tschechien,111.6,4
9789083065557,Rijks. Masters of the Golden Age,Bookbot,Tschechien,109.1,4
9789812790606,Differential Geometry and Its Applications,Bookbot,Tschechien,113.7,4
9789934819735,Movement. Visvaldis Ziedi??,Bookbot,Tschechien,108.54,4
9780194766081,New Matrix - Pre-Intermediate: Workbook,Bookbot,Tschechien,96.5,5
9780304361205,The U-Boat The Evolution and Technical History of German Submarines,"Isaiah Thomas Books & Prints, Inc.",USA,38.0,5
9780443074905,The Practice of Chinese Medicine,Bookbot,Tschechien,102.77,5
9780691117362,Landscape with Rowers: Poetry from the Netherlands (English and Dutch Edition),Book Alley,USA,6.18,5
9780860015437,The Clash: The Words and Music of 20 Clash Songs,The Book Bin,USA,56.99,5
9780951849712,The Complete Richard Allen Volume One _ Skinhead Suedehead Skinhead Escapes,San Francisco Book Company,Frankreich,85.0,5
9780952755111,Sins Plus Other Spacial Relatives,Bookbot,Tschechien,101.9,5
9781118977651,The Wiley Blackwell Handbook of the Psychology of Positivity and Strengths-Based Approaches at Work,Bookbot,Tschechien,98.1,5
9781412972666,SAGE Handbook of Mixed Methods in Social & Behavioral Research,WeBuyBooks,Vereinigtes Königreich,71.12,5
9781506714332,B.P.R.D.: 1946-1948,Bookbot,Tschechien,102.5,5
9781880985083,King Ink,knew_4_you,USA,61.74,5
9781933762043,The Fundamentals of Piping Design (Process Piping Design),HPB-Red,USA,53.19,5
9783124122001,Grundriß der Geschichte II. - Die moderne Welt,Bookbot,Tschechien,0.92,5
9783205989080,Ruinen erza?hlen,Bookbot,Tschechien,100.66,5
9783257209921,Das Dorf. Roman.,medimops,Deutschland,7.87,5
9783440098592,Das perfekte Flintenschießen: Anschlagen und zielen (Gebundene Ausgabe) von Heinz Oppermann (Autor),BUCHSERVICE / ANTIQUARIAT Lars Lutzer,Deutschland,61.59,5
9783447059282,"Slavistische Studienbücher, Neue Folge, Band. 20: Handbuch der Eurolinguistik unter Mitarbeit von Petra Himstedt-Vaid",Antiquariat Mäander Quell,Deutschland,73.7,5
9783486272598,Wissenschaftliches Arbeiten für Soziologen,medimops,Deutschland,4.35,5
9783701702480,"Oberösterreich, Salzburg, Tirol, Vorarlberg, Bd I",medimops,Deutschland,80.4,5
9783760810195,Die Kraft der Mythen. Bilder der Seele im Leben des Menschen,Antiquariat Mäander Quell,Deutschland,75.1,5
9783764363383,I send you this cadmium red .,Bookbot,Tschechien,97.3,5
9783770119721,Emilia-Romagna,Bookbot,Tschechien,99.5,5
9783800132652,Die Freiland-Schmuckstauden A-H. Band 1,Bookbot,Tschechien,78.9,5
9783800656837,Das große Handbuch Innovation 555 Methoden und Instrumente für mehr Kreativität und Innovation im Unternehmen,Buchpark,Deutschland,81.12,5
9783805348591,Seeungeheuer und Monsterfische,Bookbot,Tschechien,101.4,5
9783828904002,Welt Geschichte. Die Altorientalischen Reiche II,Bookbot,Tschechien,2.9,5
9783828905108,Welt geschichte,Bookbot,Tschechien,2.2,5
9783832176600,Migration,Bookbot,Tschechien,97.85,5
9783848000081,Florence Art and Architecture,Idle Booksellers PBFA,Vereinigtes Königreich,60.29,5
9783854461005,Internationale Zone Kriminalroman,Antiquariat Buchhandel Daniel Viertel,Deutschland,96.91,5
9783860703069,Welt Geschichte Von der Urzeit bis zur Gegenwart,Bookbot,Tschechien,3.0,5
9783863352462,Mary Heilmann: Good Vibrations,GoldenDragon,USA,4.6,5
9783867310093,Intention: Mit Gedankenkraft die Welt verändern - Globale Experimente mit fokussierter Energie,Buchhandlung Loken-Books,Deutschland,51.05,5
9783867877671,"Red Hot 100: 128 Pages, Full Color, Hardcover with Dust Jacket, 10.25 X 13.5",ThriftBooks-Dallas,USA,93.08,5
9783870708252,Illustriertes Lexikon der Welt Geschichte,Bookbot,Tschechien,6.2,5
9783884797822,Das Bauzeug der Geschichte,Bookbot,Tschechien,98.5,5
9783887092139,Das umstrittene Experiment. Der Mensch,Bookbot,Tschechien,101.79,5
9783889520937,Kalifornien,Bookbot,Tschechien,96.64,5
9783898129985,Entschwundene Stadt,Bookbot,Tschechien,100.77,5
9783899498134,Loss of Housekeeping Capacity (Tort and Insurance Law),killarneybooks,Irland,65.5,5
9783902732330,Von Stalin zu Putin,Bookbot,Tschechien,100.66,5
9783905770322,A Retrospective (tomorrow Is Another Fine Day) - Rirkrit Tir,Juanpebooks,USA,93.35,5
9783935567466,Mona Hatoum: Unhomely,EightDeerBooks,USA,85.49,5
9783993000868,"Josef Frank : Schriften/Writings Band 1,2",Bookbot,Tschechien,96.8,5
9788085770490,Oldrich Kulhanek: Drawings and Prints 1964/1996,Historien & Lexica,Niederlande,100.0,5
9788363678067,French Flying Boats of WWII,Bookbot,Tschechien,100.66,5
9789813149854,"Probabilistic Methods In The Theory Of Structures: Strength Of Materials, Random Vibrations, And Random Buckling [Soft Cover ]",booksXpress,USA,55.49,5
2566891464812,Botticelli e l'età di Lorenzo il Magnifico,Biblioteca di Babele,Italien,4.8,6
2568912652130,"Botticelli e l'età di Lorenzo il Magnifico Filippo Lippi, Antonio e Piero del Pollaiolo, Andrea del Verrocchio, Domenico Ghirlandaio, Pietro Perugino, Leonardo, Filippino Lippi, Piero di Cosimo, Fra' Bartolomeo",Biblioteca di Babele,Italien,6.4,6
4444006506382,Der Motor in Kriegsdiensten,Gyan Books Pvt. Ltd.,Indien,13.94,6
8888006854894,Der Motor in Kriegsdiensten [Hardcover],Gyan Books Pvt. Ltd.,Indien,20.48,6
9780008105754,The Art of the Lord of the Rings,MusicMagpie,Vereinigtes Königreich,54.25,6
9780071547673,Design for six sigma. A roadmap for product development.,Antiquariat Bookfarm,Deutschland,16.6,6
9780128044056,Global Energy Interconnection,Bookbot,Tschechien,89.5,6
9780307961464,April Twilights and Other Poems: Foreword by Robert Thacker (Everyman's Library Pocket Poets Series),Hippo Books,USA,5.45,6
9780333567340,ABC of Common Grammatical Errors: For Learners and Teachers of English (ELT),WorldofBooks,Vereinigtes Königreich,6.99,6
9780364474457,Der Motor in Kriegsdiensten Classic Reprint,PBShop.store US,USA,34.08,6
9780415287500,The Political Unconscious: Narrative as a Socially Symbolic Act (Routledge Classics),Chiron Media,Vereinigtes Königreich,94.66,6
9780470904039,Fixed Income Securities: Tools for Today's Markets,BookHolders,USA,36.94,6
9780656585632,Der Motor in Kriegsdiensten (Classic Reprint),PBShop.store US,USA,19.97,6
9780803200111,April Twilights,ThriftBooks-Atlanta,USA,6.28,6
9780803214484,April Twilights (Landmark Edition),Hippo Books,USA,10.83,6
9780803258518,April Twilights (Bison Book),Anybook.com,Vereinigtes Königreich,3.23,6
9780810961043,"Gerhard Richter. October 18, 1977",Bookbot,Tschechien,94.46,6
9780939386079,Who are you and why are you here?: How to find your way back home to your true inner self,ThriftBooks-Dallas,USA,85.76,6
9781409564287,Sticker Dressing Greek Myths (Usborne Sticker Dressing),WorldofBooks,Vereinigtes Königreich,5.78,6
9781496216649,April Twilights (1903),moluna,Deutschland,17.67,6
9781529325287,How To,Bookbot,Tschechien,91.1,6
9781529376920,These Hollow Vows,moluna,Deutschland,13.44,6
9781529394801,Fleabag: The Scriptures,BooksElleven,USA,71.16,6
9781529510188,Loki: A Bad God's Guide to Taking the Blame,Bahamut Media,Vereinigtes Königreich,90.44,6
9781556854811,April Twilights And More Plus Poems By Emerson,The Yard Sale Store,USA,5.69,6
9781597112734,Larry Fink on Composition and Improvisation: The Photography Workshop Series,BooksRun,USA,52.81,6
9781786980014,Tooth Preparations Science & Art,Vuestros Libros,Spanien,93.1,6
9781787376007,"Willa Cather - April Twilights: ""Whatever we had missed, we possessed together the precious, the incommunicable past""",Revaluation Books,Vereinigtes Königreich,12.53,6
9781841597942,April Twilights and Other Poems,Kennys Bookshop and Art Galleries Ltd.,Irland,13.43,6
9781847875778,The SAGE Handbook of Governance,Bookbot,Tschechien,91.9,6
9781849703475,Shadows of Treachery (22) (Horus Heresy),HPB-Emerald,USA,37.99,6
9781935429098,Air Gear - Volume 18,Bookbot,Tschechien,93.0,6
9782810500086,Botticelli et l'ère de Laurent de Médicis - Collection les grands maîtres de l'art tome 9.,Le-Livre,Frankreich,35.8,6
9783442052769,"Flieh, wenn du kannst.",medimops,Deutschland,4.39,6
9783442306336,"Flieh, wenn du kannst",medimops,Deutschland,4.55,6
9783442432622,"Flieh, wenn du kannst",Bookbot,Tschechien,1.4,6
9783442448241,"Flieh, wenn du kannst, Sonderausgabe",medimops,Deutschland,3.88,6
9783442457793,"Flieh, wenn du kannst",medimops,Deutschland,3.93,6
9783442487134,"Flieh, wenn du kannst: Roman",medimops,Deutschland,3.87,6
9783442487141,"Flieh, wenn du kannst: Roman",medimops,Deutschland,4.67,6
9783613023055,Porsche 924 - 944 - 968: Die technische Dokumentation der Transaxle-Modelle,medimops,Deutschland,26.91,6
9783701732401,Das Kraftwerk im Berg,Bookbot,Tschechien,93.6,6
9783765370007,Brockhaus - die Bibliothek,Bookbot,Tschechien,90.8,6
9783768808002,"Mercedes Benz 500 SEC, 600 SEC",Bookbot,Tschechien,90.7,6
9783775721004,In Paul Klees Zaubergarten,Bookbot,Tschechien,91.6,6
9783818600907,Tierspuren Europas -Language: german,GreatBookPricesUK,Vereinigtes Königreich,68.3,6
9783834331403,Ungewo?hnliche Motoren,Bookbot,Tschechien,90.4,6
9783836530088,Norman Mailer/Bert Stern. Marilyn Monroe,SecondSale,USA,44.17,6
9783884729007,"Der große Larousse Gastronomique. Das Standardwerk für Küche, Kochkunst, Esskultur.: 4000 Einträge, 1700 Fotos, 2500 Rezepte",online-buch-de,Schweiz,67.0,6
9783942656054,"Flieh, wenn du kannst",Bookbot,Tschechien,1.3,6
9783959390279,Winnie - die wahre Geschichte des beru?hmten Ba?ren,Bookbot,Tschechien,93.4,6
9784763680389,Pitti Pedia : International Black & White.,Librairie Vignes Online,Frankreich,90.0,6
9788461159000,"Dbook : density, data, diagrams, dwellings : a visual analysis of 64 collective housing projects = análisis visual de 64 proyectos de vivienda colectiva",Bookbot,Tschechien,94.1,6
9788485326044,Big Game Hunting in Central and Southern Europe,"Jay W. Nelson, Bookseller, IOBA",USA,55.09,6
9788829703234,Sandro Botticelli. Compianto sul Cristo morto. Ediz. italiana e inglese,libreriauniversitaria.it,Italien,11.4,6
9788836649129,Botticelli Il suo tempo e il nostro tempo,Libreria della Spada online,Italien,26.6,6
9788861301016,Anselm Kiefer,Smith Family Bookstore Downtown,USA,75.99,6
9788866480006,Filippino Lippi e Sandro Botticelli nella Firenze del '400,Miliardi di Parole,Italien,22.7,6
9789021891217,Gesammelte Schriften 1. Orientierung und Entscheidung,Bookbot,Tschechien,91.1,6
9789187896408,Josef Frank : Textile Designs,Bookbot,Tschechien,92.0,6
9789355399762,"April twilights, and other poems",moluna,Deutschland,16.83,6
9789510246627,Suomi-englanti-suomisanakirja (WSOY sanakirja),ThriftBooks-Dallas,USA,91.84,6
9780008433956,Silmarillion Illustrated Edition,GreatBookPricesUK,Vereinigtes Königreich,84.08,7
9780123869197,Herpetology: An Introductory Biology of Amphibians and Reptiles,Chiron Media,Vereinigtes Königreich,74.75,7
9780199235995,"Epictetus: Discourses, Book 1",Chiron Media,Vereinigtes Königreich,53.53,7
9780199559084,The Oxford handbook of Bayesian econometrics,Bookbot,Tschechien,85.0,7
9780321515261,GPU Gems 3: Programming Techniques for High-Performance Graphics and General-Purpose Computation,medimops,Deutschland,59.51,7
9780681219328,"Complete Novels of Jane Austen Volume Three (Northanger Abbey, Persuasion) 1996 Black Leather Tally Hall Press",Princeton Antiques Bookshop,USA,71.24,7
9780733605574,The Mozart Effect,Bookbot,Tschechien,85.52,7
9780754659068,Hellenistic and Roman Egypt : Sources and Approaches,Bookbot,Tschechien,87.9,7
9780897182072,HELP 3-6,Bookbot,Tschechien,85.9,7
9781302945084,BLACK PANTHER: THE EARLY YEARS OMNIBUS (CONAN THE BARBARIAN),Bookoutlet1,USA,57.93,7
9781407569819,Die großen Entdecker,Bookbot,Tschechien,1.3,7
9781509744114,ACCA Strategic Business Reporting,Bookbot,Tschechien,86.21,7
9781572972834,Warriors of Virtue 1: Yun and the Sea Serpent,ThriftBooks-Dallas,USA,42.22,7
9781845115418,An Anthology of Philosophy in Persia - Volume 1 : From Zoroaster to Omar Khayyam,Alhambra Books,Kanada,56.7,7
9781845170141,Madeira,Bookbot,Tschechien,86.47,7
9781854375186,Installation Art --- esaurito ----,Books Import Srl,Italien,30.0,7
9781873981108,English for Business,Bookbot,Tschechien,88.04,7
9783110282535,Proportional liability: analytical and comparative perspectives,Bookbot,Tschechien,85.3,7
9783200033627,Eseltraining - u?ber Sanftmut und Sturheit ins Vertrauen spiegeln,Bookbot,Tschechien,88.3,7
9783319908748,Finding Political Identities,moluna,Deutschland,75.3,7
9783422069589,Vom spa?tantiken Erbe zu den Anfa?ngen der Romanik (400-1000),Bookbot,Tschechien,84.4,7
9783473358304,Die grossen Religionen der Welt,Bookbot,Tschechien,2.1,7
9783484701267,Vorlesungen zur Phänomenologie des inneren Zeitbewußtseins,Versandantiquariat Felix Mücke,Deutschland,37.99,7
9783484701274,Vorlesungen zur Phänomenologie des inneren Zeitbewußtseins. Hrsg. von M. Heidegger. 2. Aufl.,Musikantiquariat Bernd Katzbichler,Deutschland,38.0,7
9783492116008,Philosophie I-III,Bookbot,Tschechien,87.13,7
9783502516880,Die großen Meisterdetektive,Bookbot,Tschechien,1.5,7
9783540707127,Stochastic Methods: A Handbook for the Natural and Social Sciences,Anybook.com,Vereinigtes Königreich,60.29,7
9783642324628,Endocytosis in plants,Bookbot,Tschechien,86.1,7
9783642526404,"Kolorimetrie und Spektralphotometrie: Eine Anleitung zur Ausführung von Absorptions-, Fluoreszenz- und Trübungsmessungen an Lösungen Eine Anleitung zur Ausführung von Absorptions-, Fluoreszenz- und Trübungsmessungen an Lösungen",NEPO UG,Deutschland,98.93,7
9783704360298,Die großen Luftschlachten des Zweiten Weltkriegs,Bookbot,Tschechien,2.47,7
9783787305971,Texte zur Phänomenologie des inneren Zeitbewusstseins 1893 - 1917,medimops,Deutschland,24.21,7
9783787324422,Zur Phänomenologie des inneren Zeitbewußtseins: Mit den Texten aus der Erstausgabe und dem Nachlaß (Philosophische Bibliothek),Bücherbazaar,Deutschland,26.88,7
9783828908048,Mystica. Die grossen Rätsel der Menschheit,Bookbot,Tschechien,2.1,7
9783833601156,Indien kulinarisch,medimops,Deutschland,6.75,7
9783836585118,Sebastião Salgado. Amazônia,moluna,Deutschland,66.58,7
9783868321418,ZeitTunnel: 2000 Jahre Köln im Spiegel der U-Bahn-Archäologie,medimops,Deutschland,11.44,7
9783881020879,Leben und werk der grossen Maler,Bookbot,Tschechien,2.0,7
9783901876110,Prozessoptimierung und analytische Personalbedarfsermittlung,Bookbot,Tschechien,84.4,7
9783927117013,Die Grossen und ihre Zeit Wolfgang Amadeus Mozart,Bookbot,Tschechien,1.4,7
9783936973693,Meisterwerke des Fahrradbaus,Bookbot,Tschechien,85.2,7
9783942240369,Gott hat mit mir etwas vorgehabt! Erinnerungen einer deutschen Sinteza« Herausgegeben von Jana Mechelhoff-Herezi und Uwe Neumärker Erinnerungen einer deutschen Sinteza,Antiquariat Mäander Quell,Deutschland,88.2,7
9786167339214,Thai Magic Tattoos. The Art and Influence of Sak Yant.,Bookbot,Tschechien,88.9,7
9788085739701,The History of European photography 1970-2000 A-U (2 svazky),Bookbot,Tschechien,88.98,7
9788682893745,Serbia: The Danube Basin,Bookbot,Tschechien,87.2,7
9788872805336,Rom und Vatikan: Heiliges Jahr 2000 mit zwei grossen Postern,Bookbot,Tschechien,1.7,7
9789024702275,"Zur Phänomenologie des inneren Zeitbewusstseins (1893-1917). Edmund Husserl. Hrsg. von Rudolf Boehm / Husserl, Edmund: Husserliana ; Bd. 10",Antiquariat  Udo Schwörer,Deutschland,90.0,7
9789058096050,Explosives and blasting technique,Bookbot,Tschechien,85.6,7
9789061824602,Rätsel des Kosmos,Bookbot,Tschechien,84.6,7
9789185213337,Nordic Architects,Broadleaf Books,Vereinigtes Königreich,28.94,7
9789401539463,"Zur Phänomenologie des Inneren Zeitbewusstseins (1893?1917) (Husserliana: Edmund Husserl ? Gesammelte Werke, 10) (German Edition)",Lucky's Textbooks,USA,395.77,7
9789603610403,Mission. Teacher's book. FCE 1,Bookbot,Tschechien,86.5,7
9780133000054,Finishing Touches,Bookbot,Tschechien,80.79,8
9780261673960,Soldiers of Evil. The Commandants of the Nazi concentration camp,Bookbot,Tschechien,82.61,8
9780262011280,Discrete Choice Theory of Product Differentiation,Porter and Frye,USA,79.79,8
9780266566502,Dem Good Ole Times Classic Reprint,PBShop.store UK,Vereinigtes Königreich,32.02,8
9780387989310,Advanced Mathematical Methods for Scientists and Engineers: Asymptotic Methods and Perturbation Theory,Greenway,USA,47.61,8
9780415160476,Dictionary of Turkic Languages,Carothers and Carothers,USA,33.25,8
9780817634612,Machinery of the Mind,Canal Bookyard,USA,23.75,8
9780817642426,Stochastic Calculus: Applications in Science and Engineering,Parabolic Books,USA,56.99,8
9780836991666,Dem Good Ole Times (Black Heritage Library Collection),mountain,USA,94.99,8
9780854881598,The Everyday,Bookbot,Tschechien,81.05,8
9781332415540,Dem Good Ole Times (Classic Reprint),Forgotten Books,Vereinigtes Königreich,16.44,8
9781409582090,See Inside the World of Shakespeare,WorldofBooks,Vereinigtes Königreich,21.68,8
9781499397185,Romeo und Julia auf dem Dorfe,medimops,Deutschland,3.18,8
9781499397246,Frau Regel Amrain und ihr Jüngster,medimops,Deutschland,3.18,8
9781499397512,Hadlaub,medimops,Deutschland,3.18,8
9781508614234,"Das Tagebuch, das Traumbuch und Reflexionen: Wenig bekannte Aufzeichnungen des jungen Gottfried Keller von wunderbar intimem Reiz",medimops,Deutschland,2.98,8
9781614285915,Ibiza Bohemia,Bookbot,Tschechien,81.77,8
9781779505842,JusticeLeaguebyScottSnyderBookTwoDeluxeEdition Format: Hardback,INDOO,USA,25.37,8
9781846864438,Bear at Work. Fun Activities,Bookbot,Tschechien,83.2,8
9781973931843,Romeo und Julia auf dem Dorfe: Volume 76 (Klassiker der Weltliteratur),medimops,Deutschland,2.95,8
9782845612419,La Rochelle : A city between towers,AwesomeBooks,Vereinigtes Königreich,81.05,8
9783122618308,"Kleider machen Leute. (Lernmaterialien) (Fiction, Poetry & Drama)",medimops,Deutschland,3.18,8
9783150061718,Pankraz der Schmoller,medimops,Deutschland,2.58,8
9783150061749,Frau Regel Amrain und ihr Jüngster,medimops,Deutschland,2.58,8
9783150061862,Sieben Legenden,medimops,Deutschland,3.11,8
9783150153130,Kleider machen Leute,Bookbot,Tschechien,1.0,8
9783150161258,Kleider machen Leute,Bookbot,Tschechien,0.92,8
9783421035875,Farbgestaltung Innenraum,Bookbot,Tschechien,83.9,8
9783423026376,Romeo und Julia auf dem Dorfe: Braunschweig 1856,medimops,Deutschland,3.18,8
9783453159655,Rezepte & Erinnerungen,HPB-Ruby,USA,29.14,8
9783454520300,"Klassische Schullektüre, Kleider machen Leute",medimops,Deutschland,2.58,8
9783464121351,Romeo und Julia auf dem Dorfe - Lehrerheft -,medimops,Deutschland,3.18,8
9783469004376,Moderne Seemacht. Zur Lage auf den Weltmeeren,medimops,Deutschland,5.06,8
9783507699977,Schroedel Lektüren: Gottfried Keller: Kleider machen Leute: Textausgabe,medimops,Deutschland,2.58,8
9783525310311,Der Krieg gegen den Westen,Bookbot,Tschechien,82.7,8
9783540798873,Preisbildung von Arzneimitteln im internationalen Vergleich.,Antiquariat Bookfarm,Deutschland,63.6,8
9783636072429,"Intelligente Rätsel-Spiele: So verbessern Sie Ihre Fähigkeit, logisch zu denken. Mit 33 neuen Rätseln",Studibuch,Deutschland,63.11,8
9783637886070,Romeo und Julia auf dem Dorfe: Band 19,medimops,Deutschland,3.18,8
9783642495366,Lehrbuch der Urologie und der Chirurgischen Krankheiten der Maennlichen Geschlechtsorgane,moluna,Deutschland,49.95,8
9783642510519,Lehrbuch der Urologie,moluna,Deutschland,54.99,8
9783662269961,Lehrbuch der Urologie,moluna,Deutschland,54.99,8
9783701703227,O?sterreichische Architektur im 20. Jahrhundert,Bookbot,Tschechien,81.1,8
9783764324575,"Die Leute Von Seldwyla 1: Birkha""user Klassiker",medimops,Deutschland,3.18,8
9783765311017,Brockhaus Enzyklopädie 1 (A-APT),Bookbot,Tschechien,4.0,8
9783765311031,Brockhaus Enzyklopädie 3 (BED-BRN),Bookbot,Tschechien,4.0,8
9783765311048,Brockhaus Enzyklopädie 4 (BRO-COS),Bookbot,Tschechien,4.0,8
9783765311079,Brockhaus Enzyklopädie 7 (EX-FRT),Bookbot,Tschechien,4.0,8
9783765311086,Brockhaus Enzyklopädie 8 (FRU-GOS),Bookbot,Tschechien,2.2,8
9783765311109,Brockhaus Enzyklopädie 10 (HERR-IS),Bookbot,Tschechien,2.2,8
9783765311116,Brockhaus Enzyklopädie 11 (IT-KIP),Bookbot,Tschechien,2.2,8
9783765311123,Brockhaus Enzyklopädie 12 (KIR-LAG),Bookbot,Tschechien,2.2,8
9783765311130,Brockhaus Enzyklopädie 13 (Lah-Maf),Bookbot,Tschechien,2.2,8
9783765311154,Brockhaus Enzyklopädie 15 (Moe-Nor),Bookbot,Tschechien,2.2,8
9783765311161,Brockhaus Enzyklopädie 16 (NOS-PER),Bookbot,Tschechien,2.2,8
9783765311185,Brockhaus Enzyklopädie18 (Rad-Rüs),Bookbot,Tschechien,2.2,8
9783765311192,Brockhaus Enzyklopädie,Bookbot,Tschechien,2.2,8
9783765311222,Brockhaus Enzyklopädie 22 (Tep-Ur),Bookbot,Tschechien,2.2,8
9783765311246,Brockhaus Enzyklopädie 24 (Wek-Zz),Bookbot,Tschechien,2.2,8
9783765336430,Der Brockhaus von A - Z. PHO-Z,Bookbot,Tschechien,1.6,8
9783765393853,Der Brockhaus 12. Roh-Ser,Bookbot,Tschechien,5.1,8
9783785576472,Armouron 6 - Verschwörung auf Planet Nu-Topia,Bookbot,Tschechien,82.0,8
9783785580875,Wings of Fire - Die Prophezeiung der Drachen: Band 1,medimops,Deutschland,13.46,8
9783806220537,Hessen Archäologie 2005,Bookbot,Tschechien,81.9,8
9783820451290,Der Nationalsozialismus als pa?dagogisches Problem,Bookbot,Tschechien,81.5,8
9783828975811,Für Dich - die schönsten Liebesgedichte [Audio-CD].,medimops,Deutschland,2.58,8
9783830013143,Naturbeziehung und perso?nliche Entwicklung,Bookbot,Tschechien,80.61,8
9783830051121,Rivalita?t in Konkurrentennetzwerken,Bookbot,Tschechien,81.3,8
9783843071062,Romeo und Julia auf dem Dorfe,medimops,Deutschland,2.58,8
9783851760101,Bertle,Bookbot,Tschechien,83.9,8
9783863354435,Malermeese-Meesermaler. Museum der Moderne Salzburg,Bookbot,Tschechien,80.8,8
9783866470521,Kleider machen Leute,medimops,Deutschland,2.97,8
9783869711997,Ursula,Bookbot,Tschechien,1.0,8
9783870248833,"Der Schmied seines Glücks, 1 Audio-CD",medimops,Deutschland,2.58,8
9783872910462,"Hamburger Lesehefte, Nr.47, Die drei gerechten Kammacher",medimops,Deutschland,2.58,8
9783872915177,Kleider machen Leute: Hamburger Leseheft plus Königs Materialien. (Hamburger Lesehefte PLUS),medimops,Deutschland,2.77,8
9783883757346,"Territories. Islands, Camps and other States of Utopia,",medimops,Deutschland,27.34,8
9783883798097,Die Leute von Seldwyla,Bookbot,Tschechien,1.01,8
9783884623251,Die karolingische Pfalzkapelle in Aachen,Bookbot,Tschechien,84.2,8
9783890602479,Baum-Yoga,Volker Ziesing,Deutschland,44.99,8
9783907509883,"Parkett No. 38 Ross Bleckner, Marlene Dumas",Black Dog Books,USA,26.13,8
9783922907497,Homeopathic Homotoxicological Repertory - Homotoxicological Materia Medica,Books From California,USA,113.99,8
9783933514820,Kleider machen Leute. 2 CDs.,medimops,Deutschland,2.58,8
9783938046562,Die Geisterseher. CD,medimops,Deutschland,2.58,8
9783980587686,generation fetish: Lee Higgs - Photographs Lee Higgs - Photographs,Antiquariat Jochen Mohr -Books and Mohr-,Deutschland,46.0,8
9788024421339,Pavel Vejvanovský and the Krom??í? Music Collection,Bookbot,Tschechien,80.61,8
9788846816665,Romeo und Julia auf dem Dorfe,medimops,Deutschland,2.58,8
9788846822765,Romeo Und Julia Auf Dem Dorfe & CD,medimops,Deutschland,2.58,8
9788870571349,Uffizi e Pitti,Bookbot,Tschechien,82.7,8
9789264185654,"Energy Policies of IEA Countries, 2000 Review",PsychoBabel & Skoob Books,Vereinigtes Königreich,14.21,8
9798736376636,Kleider machen Leute: Gottfried Keller,medimops,Deutschland,3.07,8
9780134176109,Photoshop LAB Color,Bookbot,Tschechien,80.25,9
9780175551354,English Grammar For Proficiency,dsmbooks,Vereinigtes Königreich,77.85,9
9780198117476,William Shakespeare: The Complete Works (The Oxford Shakespeare),medimops,Deutschland,4.2,9
9780198129264,William Shakespeare: The Complete Works ([The Oxford Shakespeare]),Ergodebooks,USA,10.9,9
9780198182726,The Complete Oxford Shakespeare: Volume I: Histories: 001 (The Oxford Shakespeare),WorldofBooks,Vereinigtes Königreich,5.46,9
9780198182733,The Complete Oxford Shakespeare: Volume II: Comedies: 002 (The Oxford Shakespeare),WorldofBooks,Vereinigtes Königreich,5.57,9
9780198182740,The Oxford Shakespeare: The Complete Oxford Shakespeare: Volume III: Tragedies,AwesomeBooks,Vereinigtes Königreich,5.4,9
9780198182849,Complete Works (Oxford Shakespeare),medimops,Deutschland,4.2,9
9780198711902,The Oxford Shakespeare: The Complete Works,WorldofBooks,Vereinigtes Königreich,3.45,9
9780198711919,The Complete Works (The Oxford Shakespeare),Modernes Antiquariat an der Kyll,Deutschland,9.99,9
9780199267170,The Oxford Shakespeare: The Complete Works,Buchpark,Deutschland,19.95,9
9780199267187,The Oxford Shakespeare. The Complete Works,Rheinberg-Buch Andreas Meier eK,Deutschland,24.8,9
9780199548903,The Oxford Handbook of Applied Bayesian Analysis,Bookbot,Tschechien,78.2,9
9780394736884,"A Blake Dictionary, The Ideas and Symbols of William Blake (S. Foster Damon, With a New Index by Morris Eaves)","GF Books, Inc.",USA,19.69,9
9780471359258,"The Professional Pastry Chef: Fundamentals of Baking and Pastry, 4th Edition",Hippo Books,USA,20.19,9
9780500270264,Blake Dictionary: Ideas and Symbols of William Blake,Berliner Büchertisch eG,Deutschland,8.94,9
9780525472889,A Blake Dictionary: The Ideas and Symbols of William Blake,BooksByLisa,USA,38.0,9
9780714844251,Isa Genzken,Galerie Buchholz OHG (Antiquariat),Deutschland,38.0,9
9780805812343,Conceptions of the Human Mind,Bookbot,Tschechien,78.6,9
