ISBN13,Title,Provider,Country,Price,Scanned_Page
2560037268173,COMMENTI AL VANGELO FESTIVO vol. I,Biblioteca di Babele,Italien,6.4,0
2566891087813,Commento al Vangelo quotidiano dal mercoledì delle ceneri al sabato in albis,Biblioteca di Babele,Italien,5.6,0
2566891087820,Commenti al Vangelo festivo Vol. I - II,Biblioteca di Babele,Italien,12.8,0
2566891462986,Commenti al Vangelo festivo Vol. IV: dalla XIV alla XXIV domenica dopo Pentecoste,Biblioteca di Babele,Italien,6.4,0
2568912652628,Commento al Vangelo quotidiano Dal mercoledì delle Ceneri al sabato in Albis,Biblioteca di Babele,Italien,5.6,0
9780160723001,Handbook of North American Indians - Volume 14: Southeast.,Antiquariat Ehbrecht - Preis inkl. MwSt.,Deutschland,652.0,0
9780310934486,NIV Thinline Bible.,Christian Books Australia,Australien,13.4,0
9780316072618,Gossip Girl the Complete Collection,GoldBooks,USA,769.96,0
9780415408073,Underground Space - The 4Th Dimension Of Metropolises,Collectors' Bookstore,Belgien,167.0,0
9780500544464,"The Lost Tribes of Tierra del Fuego: Selk'nam, Yamana, Kawésqar","Reader's Corner, Inc.",USA,470.19,0
9780700711314,The Iranian languages,Bookbot,Tschechien,237.7,0
9780813012698,"Antonin Nechodoma, Architect, 1877 - 1928. The Prairie School in the Caribbean",Joe Maynard,USA,356.21,0
9780826485755,The Translator as Writer,Magus Books Seattle,USA,30.14,0
9780894950506,Sex Signals. The Biology of Love,Bookbot,Tschechien,315.9,0
9781506702612,Manara Erotica Volume 1: Click! and Other Stories,Book Deals,USA,192.47,0
9781556713682,Ethnologue : Languages of Africa and Europe,Bookbot,Tschechien,237.7,0
9781614284727,Fendi Roma,Bookbot,Tschechien,280.9,0
9781850445562,Bills of Exchange and Banker's Documentary Credits,Bookbot,Tschechien,235.7,0
9781903558522,India as a New Global Leader,Bookbot,Tschechien,316.37,0
9781906863043,Lifestyle Illustration of the 60s,Seattle Goodwill,USA,95.64,0
9781912509706,The International Comparative Legal Guide to: Fintech 2019,Bookbot,Tschechien,222.1,0
9783039119523,The Making of a Building,Bookbot,Tschechien,708.68,0
9783110218435,Loanwords in the World s Languages,moluna,Deutschland,268.77,0
9783110220254,The Languages and Linguistics of Europe,moluna,Deutschland,311.39,0
9783110279696,The languages and linguistics of Australia,Bookbot,Tschechien,243.6,0
9783110286427,The languages and linguistics of the New Guinea area,Bookbot,Tschechien,219.9,0
9783110427158,The Languages and Linguistics of South Asia A Comprehensive Guide,Buchpark,Deutschland,275.89,0
9783528131159,Kurbeltriebe,Bookbot,Tschechien,296.6,0
9783791353333,David Lynch,Bookbot,Tschechien,310.4,0
9783827007384,Die Wohlgesinnten,Bookbot,Tschechien,214.07,0
9783832733186,Before they pass away,ma petite librairie,Frankreich,149.0,0
9783865607003,"OLAFUR ELIASSON: TYT [Take Your Time], Vol. 2: Printed Matter.","Ursus Books, Ltd.",USA,80.74,0
9783867877572,All American,Bookbot,Tschechien,474.94,0
9783875845839,"Führer durch das ""lasterhafte"" Berlin",Bookbot,Tschechien,240.6,0
9783903114074,Inspiration Fotografie: Von Makart bis Klimt,Bookbot,Tschechien,573.0,0
9783930944897,Göttinnen Geflüster,Bookbot,Tschechien,262.4,0
9783950001730,Marcel Dupré. Leben und Werk eines Meisterorganisten mit einem Vorwort von Jacques Barzun. Deutsche Übersetzung: Hans Uwe Hilscher. Bildzusammenstellung: Günter Lade. L'Orgue français 3.,Antiquariat Hohmann,Deutschland,280.0,0
9785730000209,Russian Icons 14th-16th centuries,Bookbot,Tschechien,351.4,0
9788884984203,Commenti al Vangelo festivo.,FIRENZELIBRI SRL,Italien,11.0,0
9788884984265,Commento al Vangelo quotidiano dal mercoledì delle ceneri al sabato in albis.,FIRENZELIBRI SRL,Italien,7.0,0
9789004186439,Encyclopedia of Chinese Language and Linguistics. Volume IV,Bookbot,Tschechien,241.4,0
9789004262249,Encyclopedia of Chinese Language and Linguistics. Volume III. Mer - Ser,Bookbot,Tschechien,247.6,0
9780500543658,Here Comes Everybody: Chris Killip's Irish Photographs,Byrd Books,USA,71.13,1
9780521195652,Cambridge Handbook of Language Policy,Libro Co. Italia Srl,Italien,116.31,1
9780521838702,Nonlinear Continuum Mechanics for Finite Element Analysis,Bookbot,Tschechien,201.33,1
9780686209058,Ventriloquism in a Nutshell,SecondSale,USA,197.47,1
9780714105451,French Porcelain: A Catalogue of the British Museum Collection,Burke's Book Store,USA,95.94,1
9780714842851,The Photobook,Collectors' Bookstore,Belgien,64.0,1
9780714845555,"Nobuyoshi Araki : Self, Life, Death",Antiquariat  Udo Schwörer,Deutschland,150.0,1
9780847845101,Chloë Sevigny,Henry Pordes Books Ltd,Vereinigtes Königreich,114.55,1
9780914675174,In Search of Christian Freedom,Bookbot,Tschechien,167.1,1
9780935621488,Greatest Kan and Li: Gathering the Cosmic Light,Dreadnought Books,Vereinigtes Königreich,8.44,1
9780940512351,"Visionary Architects : Boulee, Ledoux, Lequeu",Mahler Books,USA,213.68,1
9780958670012,Planetary Forces Alchemy & Healing,Revaluation Books,Vereinigtes Königreich,56.08,1
9780961749804,"Sing, Clean Your Brain and Stay Sound and Sane: Postulate of Mechanical Effect of Vocalization on the Brain",Buchpark,Deutschland,145.14,1
9780979137723,An Atlas of Radical Cartography,Byrd Books,USA,160.0,1
9780998407500,The Pharmagellan Guide to Biotech Forecasting and Valuation,Recycle Bookstore,USA,52.24,1
9781401228125,Dante's Inferno,HPB-Emerald,USA,63.59,1
9781556713699,Ethnologue: Languages of the Americas and the Pacific,Bookbot,Tschechien,205.0,1
9781760634384,Healthy Thermo Cooking for Busy Families: For All Brands of Thermo Device,WorldofBooks,Vereinigtes Königreich,34.7,1
9781849701358,Know No Fear (19) (Horus Heresy),HPB-Diamond,USA,32.66,1
9781937018122,Ask Leo! Guide to Routine Maintenance,Bookbot,Tschechien,161.06,1
9781938461507,Vladimir Kagan : A Lifetime of Avant-Garde Design,GreatBookPrices,USA,66.81,1
9781974725953,Demon Slayer Complete Box Set,PBShop.store UK,Vereinigtes Königreich,142.86,1
9782953571332,All Gone: The Finest of Street Culture 2012,Bookbot,Tschechien,206.1,1
9783110255133,The Indigenous languages of South America,Bookbot,Tschechien,202.1,1
9783110489712,Directors & officers' (D & O) liability,Bookbot,Tschechien,157.2,1
9783326001500,Die Ahnen Dschingis-Chans,Versandantiquariat Schröter,Deutschland,7.0,1
9783492210324,Elemente und Ursprünge totaler Herrschaft,Rheinberg-Buch Andreas Meier eK,Deutschland,28.0,1
9783492317092,Elemente und Ursprünge totaler Herrschaft,Rheinberg-Buch Andreas Meier eK,Deutschland,28.0,1
9783548031811,"Elemente und Ursprünge totaler Herrschaft, Band 1: Antisemitismus,",Antiquariat Orban & Streu GbR,Deutschland,38.0,1
9783548131825,"Arendt, Hannah: Elemente und Ursprünge totaler Herrschaft; Teil: Bd. 2., Imperialismus. Ullstein-Bücher ; Nr. 3182",Versandantiquariat Schäfer,Deutschland,35.0,1
9783548350844,Elemente und Ursprünge totaler Herrschaft I. Antisemitismus.,Antiquariat Jochen Mohr -Books and Mohr-,Deutschland,26.77,1
9783631375792,"Genanalyse als Verfassungsproblem : Zulässigkeit genanalytischer Anwendungen im Lichte von Menschenwürde und genetischem Selbstbestimmungsrecht. Studien zum internationalen, europäischen und öffentlichen Recht",NEPO UG,Deutschland,149.99,1
9783662545454,Die Erforschung des Chaos : Dynamische Systeme,AHA-BUCH GmbH,Deutschland,149.99,1
9783824804856,Verfügbarkeit und Nutzung menschlicher Ressourcen im Alter. Kernpunkte eines gerontologischen Leitkonzeptes von Mike Martin,BUCHSERVICE / ANTIQUARIAT Lars Lutzer,Deutschland,164.9,1
9783832794217,Pure,Bookbot,Tschechien,190.4,1
9783836502146,Naomi Harris. America Swings: Collectors edition,Antiquariat BuchX,Deutschland,190.2,1
9783836509060,"Naomi Harris, America Swings, Art Edition Viking",Iridium_Books,Spanien,5400.0,1
9783836522281,America swings. The Wondrous Adventures of Naomi Harris in Swingerland (July 2003 to February 2008).,Antiquariat im Lenninger Tal,Deutschland,60.0,1
9783864892233,Die öffentliche Meinung: Wie sie entsteht und manipuliert wird,medimops,Deutschland,23.57,1
9783868288827,Faszination Japan: Monet. Van Gogh. Klimt,Holt Art Books,Vereinigtes Königreich,168.82,1
9788448244040,Josep Renau. Fotomontador,Bookbot,Tschechien,184.0,1
9788846812728,Nathan Der Weise (German Edition),"Webster's Bookstore Cafe, Inc.",USA,186.18,1
9789935483270,Taste of Iceland,Bookbot,Tschechien,182.4,1
52106003959,The Old Man And The Sea (English Original),medimops,Deutschland,5.25,2
194398033020,Bach & Telemann,moluna,Deutschland,12.64,2
761203921027,Telemann: Don Quichotte (Gesamtaufnahme),ABC Versand e.K.,Deutschland,8.6,2
4444006119971,Technik der lichtbildnerei 1921,Gyan Books Pvt. Ltd.,Indien,23.44,2
7619915073424,Diamond Classics - Telemann (Bläserkonzerte/Oboenkonzerte),NEPO UG,Deutschland,3.99,2
8888006769679,Technik der lichtbildnerei 1921 [Hardcover],Gyan Books Pvt. Ltd.,Indien,28.73,2
9780020519102,The Old Man and the Sea: A Scribner Classic,medimops,Deutschland,5.56,2
9780099273967,The Old Man and the Sea (Vintage Classics),medimops,Deutschland,4.99,2
9780099595632,The Old Man and the Sea,medimops,Deutschland,8.03,2
9780099908401,The Old Man and The Sea,medimops,Deutschland,5.81,2
9780199691425,"The Survey of Pidgin and Creole Languages, Volume III: Contact Languages Based on Languages from Africa, Asia, Australia, and the Americas",Windows Booksellers,USA,44.64,2
9780241407622,Beyond Order: 12 More Rules for Life,WorldofBooks,Vereinigtes Königreich,5.23,2
9780387242910,"Oncology: An Evidence-Based Approach (Chang, Oncology)",HPB-Red,USA,38.95,2
9780412371400,"Integration of Robots into CIM Bernard, Roger; Dillman, R.; Hormann, K. and Tierney, K.",Love2Love Books,Vereinigtes Königreich,7.82,2
9780435122164,Old Man and the Sea (New Windmills),medimops,Deutschland,10.99,2
9780586044681,The Old Man and the Sea,medimops,Deutschland,3.92,2
9780684718057,The Old Man and the Sea,medimops,Deutschland,6.95,2
9780684801223,Old Man and the Sea,medimops,Deutschland,5.83,2
9780714844336,The Photobook: A History - Volume 2,Hotdog1947,USA,113.99,2
9780714857626,The Music of Painting,Bookbot,Tschechien,140.7,2
9780809312450,Becoming Alcoholic: Alcoholics Anonymous and the Reality of Alcoholism,Books-R-Keen,USA,9.49,2
9780905712031,Hemingway Omnibus: For Whom the Bell Tolls; The Snows of Kilimanjaro; Fiesta; The Short Happy Life of Francis Macomber; Across the River and Into the Trees; The Old Man and the Sea,WorldofBooks,Vereinigtes Königreich,6.92,2
9780989549721,Thirty Years of Chinese History Studies,Bookbot,Tschechien,140.5,2
9781411469723,Old Man and the Sea SparkNotes Literature Guide: Volume 52 (SparkNotes Literature Guide Series),WeBuyBooks,Vereinigtes Königreich,2.46,2
9781421580814,Bleach Box Set 2 Volumes 22-48 with Premium (Bleach Box Sets),Lakeside Books,USA,139.76,2
9781556713705,Ethnologue,Bookbot,Tschechien,154.5,2
9781586634162,Spark Notes the Old Man and the Sea: Old Man & the Sea,medimops,Deutschland,3.26,2
9781732399976,Ravensong (Green Creek),ZBK Books,USA,63.55,2
9781784965730,The Legend of Sigmar (Warhammer Chronicles),Half Price Books Inc.,USA,71.24,2
9781898592266,The Ismailis,Bookbot,Tschechien,146.02,2
9781939134004,Mesembs. The Titanopsis Group,Bookbot,Tschechien,144.12,2
9782253056249,The old man and the sea,medimops,Deutschland,4.19,2
9783110163834,"Germanen, Germania, Germanische Altertumskunde.",Antiquariat Bookfarm,Deutschland,60.1,2
9783110185881,A grammar of Lao,Bookbot,Tschechien,140.3,2
9783125773714,The Old Man and the Sea: Sekundarstufe II,medimops,Deutschland,6.14,2
9783150090756,The Old Man and the Sea,medimops,Deutschland,3.83,2
9783190001507,The Old Man and the Sea. Huebers fremdsprachliche Texte,medimops,Deutschland,6.55,2
9783200024403,Menschenbilder aus anderen Welten,Bookbot,Tschechien,130.08,2
9783334003794,Ku?nstliche Besamung bei Nutztieren,Bookbot,Tschechien,132.5,2
9783426265727,Das holographische Universum,Bookbot,Tschechien,139.7,2
9783531174365,"Die Neue Frauenbewegung in Deutschland: Abschied vom kleinen Unterschied Eine Quellensammlung (German Edition) [Hardcover] Lenz, Ilse",Brook Bookstore,Italien,135.04,2
9783540208228,General Ultrasound In the Critically Ill,Bookbot,Tschechien,139.4,2
9783740200800,"Schwarzwildreport: Mein Leben unter Wildschweinen Meynhardt, Heinz",BUCHSERVICE / ANTIQUARIAT Lars Lutzer,Deutschland,34.95,2
9783741601170,Lucifer - Mein Wille geschehe: Bd. 2,Antiquariat BuchX,Deutschland,127.2,2
9783784424408,Jesus lebte in Indien,Bookbot,Tschechien,135.2,2
9783812277778,The Old Man and the Sea: Ernest Hemingway,WeBuyBooks 2,Vereinigtes Königreich,1.48,2
9783840410680,"Reitkunst im Fokus: Die  Energetik"" der Leichtigkeit nach Dr. Stodulka Pferde gesund reiten medizinische Reitlehre Medizinische Klassische Reitlehre Arbeit an der Hand, Langer Zügel Doppellonge Reiter Sattel Tierarzt Veterinärmedizin Fachtierarzt Physiotherapie Rehabilitationsmedizin ambulante Pferde- und eine Kleintierpraxis Betreuungstierarzt Königliche andalusische Hofreitschule REAAE Jerez Fachtierarztprüfungskommission für Physiotherapie und Rehabilitationsmedizin Wien Zuchtverband des Pferdes reiner spanischer Rasse PRE Cria Caballar spanische Körkommission Dr. Robert Stodulka",BUCHSERVICE / ANTIQUARIAT Lars Lutzer,Deutschland,139.0,2
9783851570779,Übungsbuch zu Wortschatz und Stil mit Synonymenverzeichnis: Für die 5. bis 9. Schulstufe,medimops,Deutschland,11.52,2
9783866421257,"Sechs Sonaten - Band 2 - für zwei gleiche Saxophone von Georg Philipp Telemann. Spielbuch. Musiknoten. Für Altsaxophon, Tenorsaxophon, Sopransaxophon - eingerichtet von Hans-Jörg Fischer",Buchpark,Deutschland,11.81,2
9783868261042,Karten der Seele,Bookbot,Tschechien,131.2,2
9783896045157,Bibel,Bookbot,Tschechien,155.2,2
9783902312211,Trude Fleischmann - Der Selbstbewusste Blick,medimops,Deutschland,88.74,2
9783955698089,Ein Mann namens Ove,Bookbot,Tschechien,145.39,2
9788074646867,I was not able to visit the entire show. A play for two actors and a choir,Bookbot,Tschechien,137.43,2
9788087888216,The Old Man and the Sea,WorldofBooks,Vereinigtes Königreich,5.74,2
9788181320278,The Old Man and the Sea,Majestic Books,Vereinigtes Königreich,1.72,2
9788408001805,El Viejo Y El Mar/the Old Man and the Sea,medimops,Deutschland,3.68,2
9788408026266,El Viejo Y El Mar / the Old Man And the Sea,Ammareal,Frankreich,3.0,2
9788432021145,El Viejo Y El Mar/the Old Man and the Sea,medimops,Deutschland,3.63,2
9788483065303,El Viejo Y El Mar/the Old Man And the Sea (Narrativa),medimops,Deutschland,11.99,2
9788494509643,Cartier in Motion,Bookbot,Tschechien,143.77,2
9788854401334,Denmark,Bookbot,Tschechien,131.4,2
9789004203839,Implementing International Economic Law,Bookbot,Tschechien,141.96,2
9789058096180,Understanding Water in a Dry Environment _ Hydrological Processes in arid and semi-arid zones,San Francisco Book Company,Frankreich,70.0,2
9789659083305,"Peptides 2004 : Proceedings of the Third International and Twenty-Eighth European Peptide Symposium: September 5-10, 2004 Prague",Bookbot,Tschechien,135.17,2
9789681501761,El Viejo y el Mar / The Old Man And The Sea,Hamelyn,Spanien,3.99,2
9789986851943,Anti-Communist Congress and Tribunal Proceedings,Bookbot,Tschechien,137.6,2
9790007056551,"Telemann: Jauchzet, ihr Himmel (TVWV 1:957). Partitur",medimops,Deutschland,9.61,2
9790007095994,Telemann: Zwölf Spruchkanons. Partitur,medimops,Deutschland,4.2,2
9790202320259,Deutsche Klaviermusik des 17. und 18. Jahrhunderts Band 5Telemann Ouvertüren 4-6,Smartbuy,Deutschland,8.2,2
9780001720138,Mr Sparks to the rescue,Bookbot,Tschechien,1.5,3
9780007271436,Sleepover Girls on Horseback (The Sleepover Club),medimops,Deutschland,3.18,3
9780140294767,Spy by Nature,medimops,Deutschland,3.63,3
9780194766074,New Matrix - Pre-intermediate: Student's Book,Bookbot,Tschechien,115.7,3
9780230470200,Othello,Iridium_Books,Spanien,88.56,3
9780415353397,The world's major languages,Bookbot,Tschechien,114.7,3
9780471496625,The Cell Cycle and Development,Wonder Book,USA,18.99,3
9780563214557,Make Money Make Money,medimops,Deutschland,2.58,3
9780563215288,The Colour Eye,medimops,Deutschland,3.09,3
9780575082700,Elric Of Melnibone,Collectors' Bookstore,Belgien,85.0,3
9780582748088,ARCHIT & BUILDING CONSTRUCTION,medimops,Deutschland,3.18,3
9780801863967,Theory of the Novel: A Historical Approach,"The Book Cellar, LLC",USA,59.37,3
9780805397901,Genetic Recombination,medimops,Deutschland,3.63,3
9780817009243,Overcoming Communication Barriers in the Church,medimops,Deutschland,2.58,3
9780864422071,Lonely Planet China (Lonely Planet Travel Survival Kit),medimops,Deutschland,3.63,3
9780864422767,Lao Phrasebook Lonely Planet Language Survival Kits,medimops,Deutschland,2.62,3
9780864423818,Laos (Lonely Planet Laos),medimops,Deutschland,3.14,3
9780870333477,Chadwick the Crab,medimops,Deutschland,3.18,3
9780870333774,CHADWICK & THE GARPLEGRUNGEN,medimops,Deutschland,3.63,3
9780874402315,"Kiss, Then Tell",medimops,Deutschland,2.58,3
9780880129268,Handwriting Traditional Cursive Homework Booklet (Homework Booklets),medimops,Deutschland,2.58,3
9780895244734,Roxette: Look Sharp!,HPB Inc.,USA,33.54,3
9780898387476,Head and Neck Management of the Cancer Patient,Bookbot,Tschechien,120.2,3
9780908086573,Thailand (Lonely Planet Phrasebook),medimops,Deutschland,2.58,3
9780937325117,Women and Nutrition,medimops,Deutschland,3.18,3
9780940111035,Unconditional Love and Forgiveness,ThriftBooks-Atlanta,USA,69.82,3
9781138801981,The Routledge Handbook of Migration and Language (Routledge Handbooks in Applied Linguistics),BooksRun,USA,126.27,3
9781338034523,"March of the Vanderpants (Notebook of Doom, Band 12)",medimops,Deutschland,2.58,3
9781338314762,"Hydrant-Hydra: A Branches Book (the Binder of Doom #4), Volume 4",medimops,Deutschland,2.58,3
9781405199476,Identity and Participation in Culturally Diverse Societies: A Multidisciplinary Perspective,Campus Bookstore,USA,23.66,3
9781419705564,Louis Vuitton : The Birth of Modern Luxury,GreatBookPricesUK,Vereinigtes Königreich,88.67,3
9781448653492,"Happily Domesticated: Musings on Life, Love, Parenthood, Malfunctioning Appliances and Marital Bliss",medimops,Deutschland,3.18,3
9781472434463,Urban Grassroots Movements in Central and Eastern Europe (Cities and Society),Chaucer Bookshop ABA ILAB,Vereinigtes Königreich,97.67,3
9781490540139,Survival:: A Moral Response to Global Warming,medimops,Deutschland,3.18,3
9781504328425,"The Sensational Salesman: A Second Chance Story: Providing a Simple Path to Improving Your Relationships, Career, and Life",medimops,Deutschland,2.58,3
9781566918015,Moon Cabo: Including La Paz and Todos Santos,medimops,Deutschland,2.58,3
9781582701646,John of God: The Brazilian Healer Who's Touched the Lives of Millions: Healing Through Love,medimops,Deutschland,3.63,3
9781592336685,Sex Games Mini Book (Quiver Minis),medimops,Deutschland,2.58,3
9781734303841,Thrust,Dream Books Co.,USA,94.99,3
9781740591904,Myanmar (Burma),Bookbot,Tschechien,1.3,3
9781740593564,Thailand,Bookbot,Tschechien,1.5,3
9781786330994,The Anglo-Saxons,Bookbot,Tschechien,118.9,3
9781799839798,Real-Time and Retrospective Analyses of Cyber Security,Bookbot,Tschechien,115.2,3
9781933952260,The Photograph: Composition and Color Design,Goodwill,USA,2.8,3
9781937538064,The Photograph: Composition and Color Design,Hippo Books,USA,49.8,3
9782280201803,Cette fille est dangereuse - playing games,medimops,Deutschland,3.18,3
9782859173999,Diego Giacometti,Bookbot,Tschechien,118.6,3
9783000294099,João de Deus,medimops,Deutschland,3.63,3
9783030912246,"Civic and Uncivic Values in the Czech Republic : Value Transformation, Politics, Education, and Gender Equality",Bookbot,Tschechien,117.5,3
9783110269970,Medical malpractice and compensation in global perspective,Bookbot,Tschechien,120.0,3
9783224111370,Putzis weitere lustige Streiche,medimops,Deutschland,27.49,3
9783423702294,Feuer über Virginia.,medimops,Deutschland,2.58,3
9783502612117,"Aufwachen zu dem, der du bist: Die Zen-Unterweisungen des Meisters Linji die Zen-Unterweisungen des Meisters Linji",Book Broker,Deutschland,123.15,3
9783658235543,Gesunde Gestaltung : Priming- und Placebo-Effekte als gesundheitsverhaltenswirksame empiriegestützte Gestaltungsmethodik,AHA-BUCH GmbH,Deutschland,84.99,3
9783702300548,Clemens Holzmeister. Architekt in der Zeitenwende. Selbstbiografie. Werkvereichnis.,Antiquariat Kunsthaus-Adlerstrasse,Deutschland,80.0,3
9783702503253,Gau der guten Nerven. Die nationalsozialistische Herrschaft in Salzburg 1938 - 1945.,ANTIQUARIAT BÜCHERBERG Martin Walkner,Österreich,108.0,3
9783791350929,Geschichte der Rekonstruktion - Konstruktion der Geschichte,Bookbot,Tschechien,126.5,3
9783832796785,Senses,Bookbot,Tschechien,114.9,3
9783836539487,Mario Testino. Private View,Holt Art Books,Vereinigtes Königreich,60.29,3
9783854282525,Einfu?hrung in die Kostenrechnung,Bookbot,Tschechien,115.04,3
9783861273424,Barockes Reiten nach F.R. de la Guérinière. Über die Ausbildung des Pferdes,Studibuch,Deutschland,69.31,3
9783861878902,Side by Side. The Journal of a Small Town Boy,Bookbot,Tschechien,117.12,3
9783867871051,Still side by side,Bookbot,Tschechien,125.2,3
9783893226184,Kunst + Design. Donald Judd.,Antiquariat & Verlag Jenior,Deutschland,120.0,3
9783900803261,Wittgenstein,Bookbot,Tschechien,127.8,3
9783908247319,Heteroptera: Texte in Englisch,medimops,Deutschland,43.97,3
9785842500017,Anglo-russkiy I Russko-angliyskiy Sovremennyy Slovar' + Grammatika),Bookbot,Tschechien,125.4,3
9787800051357,Creation of Gods II,Bookbot,Tschechien,126.1,3
9788880586340,Friuli. Path of flavours,Bookbot,Tschechien,121.19,3
9788890040009,Le Marche 'Terra sconosciuta'/Marches - The Undiscovered Territory (Italian and English Edition),Blindpig Books,USA,90.55,3
9789020938869,Flemish tapestry,Bookbot,Tschechien,115.5,3
9789020947212,INVITATIONS,Koster's Collectible Books,USA,85.48,3
9789633860106,"Czechoslovak Diplomacy and the Gulag: Deportation of Czechoslovak Citizens in the USSR and the Negotiation for Their Repatriation, 1945-1953: . Negotiation for Their Repatriation, 1945-1953",Brook Bookstore,Italien,95.78,3
9789839439984,A Map of the Journey,Bookbot,Tschechien,121.5,3
9780043012734,Feminist Experiences,Bookbot,Tschechien,108.6,4
9780128013687,Lanzkowsky's Manual of Pediatric Hematology and Oncology,Books From California,USA,94.43,4
9780323544702,Point of Care Ultrasound,Book Deals,USA,86.49,4
9780692686621,Tatau - Marks of Polynesia,Bookbot,Tschechien,106.0,4
9780714842929,BRAZIL'S MODERN ARCHITECTURE,LIBRERIA LEA+,Chile,96.2,4
9780733316531,1001 Albums You Must Hear Before You Die,Books@Ruawai,Neuseeland,17.47,4
9780754672760,Planning in Crisis?: Theoretical Orientations for Architecture and Planning,Juggernautz,USA,18.51,4
9780789313713,1001 Albums You Must Hear Before You Die: (cfr: 9781844033928),WorldofBooks,Vereinigtes Königreich,42.45,4
9780789320742,1001 Albums You Must Hear Before You Die: Revised and Updated Edition,Pieuler Store,Vereinigtes Königreich,81.55,4
9780849328954,Crop Ferality and Volunteerism,Corner of a Foreign Field,Japan,38.0,4
9780930267322,"Dictionary of Commercial, Financial and Legal Terms",Bookbot,Tschechien,113.31,4
9781402024108,Vavilov-Cherenkov and Synchrotron Radiation,Bookbot,Tschechien,109.3,4
9781407186788,The Illustrated World of Mortal Engines - 4x Signed with Signed Print Mint New 1st Print Hardcover,UKBookworm,Vereinigtes Königreich,90.44,4
9781474293389,PHOTOGRAPHY & FAILURE,moluna,Deutschland,113.55,4
9781569712276,Dirty Pair: Dangerous Acquaintances,ZBK Books,USA,85.16,4
9781843766889,The Welfare Economics of Public Policy,Bookbot,Tschechien,114.1,4
9781844033928,1001 Albums: You Must Hear Before You Die (1001 Must Before You Die),WorldofBooks,Vereinigtes Königreich,5.12,4
9781844036240,1001 Albums You Must Hear Before You Die,AwesomeBooks,Vereinigtes Königreich,4.05,4
9781844036998,1001 Albums You Must Hear Before You Die,GoldBooks,USA,35.56,4
9781844037353,1001: Albums You Must Hear Before You Die,WorldofBooks,Vereinigtes Königreich,20.93,4
9781844038909,1001 Albums You Must Hear Before You Die,PAPER CAVALIER UK,Vereinigtes Königreich,72.6,4
9782847070187,Motorcycle Yearbook 2002,Bookbot,Tschechien,114.6,4
9783110546002,Product liability,Bookbot,Tschechien,107.3,4
9783319805689,Logotherapy and Existential Analysis,Bookbot,Tschechien,109.3,4
9783319988290,The Philosophy of Affordances (New Directions in Philosophy and Cognitive Science),GoldenWavesOfBooks,USA,71.08,4
9783540658030,"Erlebens- und Verhaltenssto?rungen, Abha?ngigkeit und Suizid",Bookbot,Tschechien,109.3,4
9783702905491,Glauben und Wissen,Bookbot,Tschechien,107.2,4
9783777498003,Wandmalerei der Giottozeit in Italien 1280-1400 (German Edition),Arundel Books,USA,94.99,4
9783794528899,Nuklearmedizin,Bookbot,Tschechien,114.1,4
9783836520201,"The Little Book of Pin-Up Vargas: The War Years, 1940-1946",GoldBooks,USA,24.16,4
9783836554565,75 Years of DC Comics: The Art of Modern Mythmaking,"Book Merchant Jenkins, ANZAAB / ILAB",Australien,93.03,4
9783850766050,Globalized Psychotherapy,Bookbot,Tschechien,109.76,4
9783854984009,Paradies Wachau. Gemaltes Kulturerbe,medimops,Deutschland,7.48,4
9783855800100,Schwester Agnes erzählt weiter Aus dem Tagebuch einer Gemeindeschwester,Book Broker,Deutschland,110.83,4
9783889274359,Agenda Setting und Internet,Bookbot,Tschechien,106.54,4
9783895782091,Ro?ntgenaufnahmetechnik,Bookbot,Tschechien,104.8,4
9783899550429,Autograf: New York City's Graffiti Writers By Peter Sutherland,The land of Nod - art & books,Belgien,65.0,4
9783908644866,Baphomet,Bookbot,Tschechien,109.3,4
9783921392188,Der kleine Eichborn,Bookbot,Tschechien,109.3,4
9783925369445,Goldschmiedekunst,Bookbot,Tschechien,105.9,4
9783934613942,Gefangen im arktischen Eis,Bookbot,Tschechien,110.4,4
9783942473774,Familienporträts. Fotografien 1974-1994.,Antiquariat Matthias Wagner,Deutschland,100.1,4
9785717200776,Ivan the Fool. Russian Folk Belief. A Cultural History,Bookbot,Tschechien,105.82,4
