ISBN13,Title,Provider,Country,Price,Scanned_Page
9780824700560,"Expanding Indications for the New Macrolides, Azalides, and Streptogramins",Books Puddle,USA,55.17,9
9780847840212,Dolce and Gabbana Campioni,Bookbot,Tschechien,78.2,9
9780870570889,A Blake Dictionary : The Ideas and Symbols of William Blake,Better World Books,USA,48.86,9
9780874514360,A Blake Dictionary: The Ideas and Symbols of William Blake,Wizard Books,USA,66.89,9
9780993359101,A Pink Flamingo,Books for Amnesty Bristol,Vereinigtes Königreich,48.23,9
9781402058844,Acid Rain - Deposition to Recovery,books4less (Versandantiquariat Petra Gros GmbH & Co. KG),Deutschland,13.0,9
9781492832584,Haschisch,Revaluation Books,Vereinigtes Königreich,9.99,9
9781542614382,Haschisch: ErzÃ¤hlungen (German Edition) [Soft Cover ],booksXpress,USA,11.31,9
9781610690171,"Ethnic Groups of North, East, and Central Asia: An Encyclopedia (Ethnic Groups of the World)",Hippo Books,USA,59.63,9
9781611684438,A Blake Dictionary: The Ideas and Symbols of William Blake,Ergodebooks,USA,32.09,9
9781614288626,Palm Beach,Bookbot,Tschechien,76.62,9
9781849494694,Vogue on: Valentino Garavani (Vogue on Designers),WorldofBooks,Vereinigtes Königreich,32.49,9
9781857801811,Early Soviet Jet Bombers - Red Star Vol. 17,Southampton Books,USA,47.49,9
9781867429647,Reinforcment Learning. a Complete Guide 2021,Bookbot,Tschechien,77.24,9
9781882423125,Effective Phrases for Performance Appraisals,Bookbot,Tschechien,80.6,9
9783100515100,Van Gogh: Sein Leben,Fachbuch-Versandhandel,Deutschland,70.95,9
9783222121258,Staatskanzler Metternich und seine Gäste - die wiedergefundenen Miniaturen,medimops,Deutschland,29.23,9
9783319085470,Probabilistic Safety Assessment of WWER440 Reactors,Bookbot,Tschechien,80.2,9
9783411110148,"Meyers großes Taschenlexikon (24 svazk?, komplet)",Bookbot,Tschechien,78.96,9
9783484701250,Ideen zu einer reinen Phänomenologie und phänomenologischen Philosophie : allg. Einf. in d. reine Phänomenologie.,Antiquariat BehnkeBuch,Deutschland,15.0,9
9783706514149,O?sterreichs Außenpolitik der Zweiten Republik,Bookbot,Tschechien,77.1,9
9783717580379,"Der Krieg gegen Frankreich 1870-1871: Gesamtausgabe in 4 Bänden Bd. 1. Der Krieg gegen das Kaiserreich : bis Gravelotte, 18. August 1870 ; mit 32 Pl. d. Orig.-Ausg. Berlin 1873 - 1876 u. 20 Portr. nach Stichen d. Zeit",Antiquariat Mäander Quell,Deutschland,90.9,9
9783743702493,Haschisch:ErzÃ¤hlungen,Ria Christie Collections,Vereinigtes Königreich,14.4,9
9783743702509,Haschisch,moluna,Deutschland,16.8,9
9783775709095,Picasso - the Sculptures - Catalogue Raisonne,EGIDIUS ANTIQUARISCHE BOEKHANDEL,Niederlande,70.0,9
9783784105888,Streitobjekt Jugendhilfe,Bookbot,Tschechien,79.73,9
9783787310944,"Ideen zu einer reinen Phänomenologie und phänomenologischen Philosophie. Erstes Buch: Allgemeine Einführung in die reine Phänomenologie, Nachwort (1930).",Antiquariat Hieronymus,Deutschland,38.0,9
9783787319190,Ideen zu einer reinen Phänomenologie und phänomenologischen Philosophie,sinnvoll24,Deutschland,24.9,9
9783800140558,Der landwirtschaftliche Betrieb,Bookbot,Tschechien,78.4,9
9783847236412,Haschisch,Smartbuy,Deutschland,9.9,9
9783848766987,Ikonisches Wissen,Bookbot,Tschechien,76.4,9
9783850933919,Ernst Brandl und das Penicillin V: Schwazer Kostbarkeiten 11,medimops,Deutschland,4.61,9
9783851327649,"Vom Intimen. Fern der lärmenden Liebe,",modernes antiquariat f. wiss. literatur,Deutschland,38.0,9
9783852180373,"DADA 21 / 22. Musikalische Fischsuppe mit Reiseeindrücken. Eine Dokumentation über die beiden Dadajahre in Tirol & & Ein Fortsatz: Gerald Nitsche, DADA und danach.",Heinrich Heine Antiquariat oHG,Deutschland,40.0,9
9783898409278,Haschisch E.A.Poes phantastische Bibliothek 7,Storisende Versandbuchhandlung,Deutschland,9.95,9
9783898801058,Porsche 924 & 944. Mit vier Zylindern zum Erfolg,Celler Versandantiquariat,Deutschland,37.0,9
9783900323479,Haschisch,Book Deals,USA,255.25,9
9783900602062,Ausgelöscht - Vom Leben der Juden in Mödling,medimops,Deutschland,74.86,9
9783935567480,Albert Oehlen: 1991 2008,ThriftBooks-Dallas,USA,69.82,9
9783950150100,Alvar Aalto: Möbel. Die Sammlung Kossdorff,Bookbot,Tschechien,76.5,9
9783950264883,"Die k.k.St.B. Triebfahrzeuge. Die Triebfahrzeuge der k.k. österreichischen Staatsbahnen. Band 4, Die Reihen 83 bis 100, Schmalspur- und nicht mit Dampf betriebene Bauarten",Bookbot,Tschechien,77.9,9
9783954982158,Die Ernestiner: Eine Dynastie prägt Europa,medimops,Deutschland,18.49,9
9783966621212,Ideen zu einer reinen Phänomenologie und phänomenologischen Philosophie : Allgemeine Einführung in die reine Phänomenologie,AHA-BUCH GmbH,Deutschland,42.0,9
9783969650110,TERRA MAXIMA: Atlas der Superlative,Chiron Media,Vereinigtes Königreich,46.1,9
9788026856139,Haschisch,moluna,Deutschland,8.98,9
9788027251001,Haschisch,Revaluation Books,Vereinigtes Königreich,11.75,9
9788027364251,Haschisch: Phantastische Erzählungen,Smartbuy,Deutschland,7.6,9
9789024702190,Ideen zu einer reinen Phänomenologie und phänomenologischen Philosophie. Drittes Buch,Buchhandlung Bücken,Deutschland,39.0,9
9789356708631,Haschisch: ErzÃ¤hlungen,Ria Christie Collections,Vereinigtes Königreich,15.41,9
9780007190904,Collins World Atlas,WeBuyBooks 2,Vereinigtes Königreich,26.19,10
9780262521987,English Syntax - 2nd Edition,Midtown Scholar Bookstore,USA,1.77,10
9780273714910,Brilliant Life Coach: 10 Inspirational Steps to Transform Your Life (Brilliant Lifeskills),WorldofBooks,Vereinigtes Königreich,0.92,10
9780443029370,Fractures and Joint Injuries. Volume II,Bookbot,Tschechien,74.0,10
9780500290507,Typography: (E) (Graphic Design in Context),WorldofBooks,Vereinigtes Königreich,4.41,10
9780521564816,Global Biodiversity Assessment,ThriftBooks-Atlanta,USA,43.11,10
9780751362145,Barbie: A Visual Guide to the Ultimate Fashion Doll,WorldofBooks,Vereinigtes Königreich,12.54,10
9780810946033,Slim Aarons: Once Upon A Time,Goodwill Industries of VSB,USA,39.34,10
9780849378027,"Introduction to Neurobehavioral Toxicology: Food and Environment (Handbooks in Pharmacology and Toxicology, 51)",Phatpocket Limited,Vereinigtes Königreich,69.07,10
9780854881611,Appropriation : Documents of Contemporary Art,Marcus Campbell Art Books,Vereinigtes Königreich,60.29,10
9781137478207,"Leveraged Exchange-Traded Funds: A Comprehensive Guide to Structure, Pricing, and Performance",Lucky's Textbooks,USA,48.13,10
9781567182675,Legend,Bookbot,Tschechien,73.2,10
9781632365200,Welcome to the Ballroom 7,Bookbot,Tschechien,75.2,10
9781853321580,"Beyond reason. Art and psychosis ; works from the Prinzhorn Collection. [Publ. by the occasion of the exhibition ""Beyond reason.Art and Psychosis .5.Dec.1996-23 Febr.1997.A version of this exhib., entitled La Beauté Insensée, was shown at the Palais des Beaux-Arts,Charleroi,Belgium, 14. Oct.1995-28. Jan.1996.Other recent showings.:Wahnsinnige Schönheit, Schloss Heidelberg, 30.March-28.April1996; La Collection Prinzhorn, Collection de l'Art Brut, Lausanne,11 June-22 Sept.1996;Wahnsinnige Schönheit,Kulturgeschichtliches Museum Osnabrück, 6. April-1. June 1997.",Antiquariat Bookfarm,Deutschland,46.6,10
9781856699372,Hide and Seek,Bookbot,Tschechien,76.2,10
9782608239990,"City- NT, Neues testament für Regensburg",Bookbot,Tschechien,3.4,10
9782804474751,MORAL RIGHTS IN THE 21ST CENTURY: The Changing Role of Moral Rights in an Era of Information Overload,Amazing Book Company,Vereinigtes Königreich,48.23,10
9782911596346,Tadao Ando,Bookbot,Tschechien,76.2,10
9783326000831,Allgemeine Relativitätstheorie Eine Einführung in die Theorie des Gravitationsfeldes,Buchpark,Deutschland,66.82,10
9783417256208,Neues Testament und Psalmen,Bookbot,Tschechien,2.4,10
9783417261066,Das Buch. Neues Testament,Bookbot,Tschechien,27.4,10
9783424350845,Gru?ne Philosophie,Bookbot,Tschechien,74.9,10
9783437222610,Public Health,Bookbot,Tschechien,76.0,10
9783438015525,Die gute Nachricht : Altes und Neues Testament,Bookbot,Tschechien,1.6,10
9783438026316,Gute Nachricht Neues Testament,Bookbot,Tschechien,3.3,10
9783451189883,Die Bibel : Altes und Neues Testament : Einheitsübersetzung,Bookbot,Tschechien,8.59,10
9783540282655,Breast Cancer Management and Molecular Medicine,Buchpark,Deutschland,22.9,10
9783625134411,"Das große Kräuterlexikon: 1000 Kräuter, Heilpflanzen und Gewürze im Porträt",medimops,Deutschland,11.87,10
9783629010773,Die Bibel des 20. Jahrhunderts : Altes und Neues Testament,Bookbot,Tschechien,10.7,10
9783700180234,Kaltblutpferde im Spiegel der Wissenschaft,Bookbot,Tschechien,74.2,10
9783701401895,Feindfahrten. Das Logbuch eines U-Bootfunkers.,Eugen Friedhuber KG,Österreich,15.0,10
9783705901971,Jugendstil in Graz,Bookbot,Tschechien,73.5,10
9783742879738,"Real-Encyclopädie der gesammten Pharmacie: Handwörterbuch für Apotheker, Ärzte und Medicinalbeamte : Handwörterbuch für Apotheker, Ärzte und Medicinalbeamte",AHA-BUCH,Deutschland,28.47,10
9783744630573,"Real-Encyclopädie der gesammten Pharmacie: Handwörterbuch für Apotheker, Ärzte und Medizinalbeamte (German Edition)",Lucky's Textbooks,USA,56.04,10
9783777426259,Die großen Schnitzalta?re,Bookbot,Tschechien,76.0,10
9783829568173,Grands nus,Bookbot,Tschechien,75.4,10
9783832793463,Back Stage Dior Foreword & Fashion By John Galliano,Elefante de los Libros,Spanien,58.0,10
9783833151408,Ars Sacra,Bookbot,Tschechien,68.9,10
9783836585606,Witchcraft. The Library of Esoterica,Welcome Back Books,USA,32.57,10
9783853651872,"Das Gulasch-Kochbuch: Alte und neue Rezepte Dippelreither, Reinhard",BUCHSERVICE / ANTIQUARIAT Lars Lutzer,Deutschland,69.95,10
9783861500537,Plastic People. Songbuch,medimops,Deutschland,48.51,10
9783884622728,Die Chorfenster der St. Marienkirche in Frankfurt (Oder),Bookbot,Tschechien,73.29,10
9783900633073,Das grosse Fleischbuch. Band 1,Bookbot,Tschechien,75.2,10
9783969210031,Der Sommer 1893 in Spillville,Big River Books,USA,43.63,10
9784861522840,Another Scale of Architecture,Bookbot,Tschechien,74.78,10
9787800478598,Cartier Treasures,Bookbot,Tschechien,76.1,10
9788070356135,"Kaiser Karl IV., 1316-2016",Bookbot,Tschechien,73.4,10
9780007144082,"The Lord of the Rings and the Hobbit (Modern Classic Set, 4 PBs in slipcase)",Durdles Books (IOBA),Vereinigtes Königreich,26.53,11
9780226769332,"The Complete Works: Handbook, Discourses, and Fragments",Kennys Bookshop and Art Galleries Ltd.,Irland,49.44,11
9780393542240,Essentials of Comparative Politics with Cases,BooksRun,USA,64.08,11
9780415762151,Ontological Security in International Relations,Blackwell's,Vereinigtes Königreich,56.66,11
9780908802357,Secret Power. New Zealand's Role in the International Spy Network.,Phoenix Books NZ,Neuseeland,46.59,11
9780942299434,Formless : a user's guide,Bookbot,Tschechien,71.7,11
9780945454236,The Hermeneutics of Sacred Architecture,Bookbot,Tschechien,71.9,11
9780990422402,CLOG: Rem,ThriftBooks-Dallas,USA,69.32,11
9781614287810,The Wine in the Sky Questionnaire,Bookbot,Tschechien,71.9,11
9781937518493,10 Years of Swiss Rules of International Arbitration: ASA Special Series No. 44,Ammareal,Frankreich,54.99,11
9783170329300,Grundriss der Psychologie: Entwicklungspsychologie der Kindheit: Von der Geburt bis zum 12. Lebensjahr (Urban-Taschenbücher),medimops,Deutschland,30.29,11
9783499108389,Gabriela wie Zimt und Nelken,Bookbot,Tschechien,71.3,11
9783593386249,Führen mit dem Big-Five-Persönlichkeitsmodell - Handelsblatt: Das Instrument für optimale Zusammenarbeit (Handelsblatt - Erfolgreich führen),Studibuch,Deutschland,43.93,11
9783642434099,Linear Algebra and Geometry,moluna,Deutschland,44.67,11
9783800139248,Biologische Invasionen. Neophyten und Neozoen in Mitteleuropa. Mit einem Beitr. von Peter Boye. 73 Zeichnungen. 76 Tabellen.,Buchparadies Rahel-Medea Ruoss,Schweiz,49.9,11
9783816810315,Einkommensteuer,Démons et Merveilles,Frankreich,19.7,11
9783825241636,Themenorientierte Literaturdidaktik: Helden im Mittelalter: Konzept und Praxisbeispiele,Studibuch,Deutschland,28.66,11
9783831007400,"Inka, Maya und Azteken",Bookbot,Tschechien,72.5,11
9783836287005,"Heimautomation mit KNX, Dali, 1-Wire und Co.",GreatBookPricesUK,Vereinigtes Königreich,47.75,11
9783853490983,Sommervillen im Salzkammergut,Bookbot,Tschechien,71.5,11
9783874951326,"Johannes, das große Evangelium, 11 Bde., Ln, Bd.2",Antiquariat BuchX,Deutschland,60.0,11
9783878601722,Im Lichte der Wahrheit - Gralsbotschaft Band I,biblion2,Deutschland,56.86,11
9783879757510,Ein neues Akkumulationsregime,Bookbot,Tschechien,71.3,11
9783898600422,"FCI Hunderassen, MiniAtlas [Gebundene Ausgabe] Dominik Kieselbach Petra Caspelherr Elke Peper Hunde Hunderassen Rassehunde VDH dogs Hobbytierhaltung",BUCHSERVICE / ANTIQUARIAT Lars Lutzer,Deutschland,69.95,11
9783899841039,Fachlexikon Immobilienwirtschaft (erw. Aufl. inkl. Online-Zugang),Studibuch,Deutschland,15.16,11
9783906390666,Scent and Chemistry,Bookbot,Tschechien,70.89,11
9783929305784,Gradieren,Bookbot,Tschechien,65.0,11
9783950278675,Coufstein. Kueffstain. Kufstein,Bookbot,Tschechien,70.3,11
9783990270752,Freie Folge,Bookbot,Tschechien,72.5,11
9788391698785,"Fangor, prace na papierze w kolorze, works on paper in color",Bookbot,Tschechien,72.5,11
9789027202819,New Perspectives on Endangered Languages,Bookbot,Tschechien,71.3,11
9789834303860,"Robert Kalina, The Man Behind The Euro",Bookbot,Tschechien,70.8,11
9789987667017,Zanzibar Style,Bahamut Media,Vereinigtes Königreich,9.41,11
9780007950300,A Game of Thrones. The Graphic Novels 1-4,Bookbot,Tschechien,69.1,12
9780030037344,Alternativen,Bookbot,Tschechien,69.3,12
9780304330034,May I Help You?: Course for Hotel Restaurant and Bar Staff (English in tourism),Phatpocket Limited,Vereinigtes Königreich,46.0,12
9780415126243,The metaphoric process: connections between language and life,Bookbot,Tschechien,69.8,12
9780415339568,Understanding International Art Markets And Management,Bookbot,Tschechien,67.8,12
9780462004464,ACHIEVE TOEIC+CD,AG Library,Spanien,43.99,12
9780545010221,Harry Potter and the deathly Hallows - Buch 7,medimops,Deutschland,4.2,12
9780563369844,From A to B: Tales of Modern Motoring,Dreadnought Books,Vereinigtes Königreich,60.29,12
9780582204133,Captain John Smith and Virginia,Bookbot,Tschechien,67.8,12
9780700711970,Encyclopedia of the World's Endangered Languages (Curzon Language Family Series),"Powell's Bookstores Chicago, ABAA",USA,37.76,12
9780714894270,Kunst und Körper,Précipice,Schweiz,66.13,12
9780747542988,"Rowling, Joanne K., Vol.1 : Harry Potter and the Philosopher's Stone; Harry Potter und der Stein der Weisen, englische Ausgabe",medimops,Deutschland,3.57,12
9780747549505,Harry Potter 3 and the Prisoner of Azkaban,medimops,Deutschland,4.37,12
9780747549604,Harry Potter 2 and the Chamber of Secrets,medimops,Deutschland,4.24,12
9780747551003,Harry Potter and the Order of the Phoenix,medimops,Deutschland,4.02,12
9780747554660,Fantastic Beasts and Where to Find Them. Comic Relief Edition (Harry Potter's Schoolbooks),medimops,Deutschland,2.58,12
9780747554714,Quidditch Through the Ages. Comic Relief Edition (Harry Potter's Schoolbooks),medimops,Deutschland,4.23,12
9780747558194,Harry Potter and the Philosopher's Stone: Celebratory Edition,medimops,Deutschland,3.63,12
9780747581086,Harry Potter and the Half-Blood Prince: Children's Edition,medimops,Deutschland,4.02,12
9780747591054,Harry Potter and the Deathly Hallows (Harry Potter 7),medimops,Deutschland,4.02,12
9780747591061,Harry Potter and the Deathly Hallows (Harry Potter 7) (Adult Edition),medimops,Deutschland,4.02,12
9780751565355,Harry Potter and the Cursed Child - Parts I & II (Special Rehearsal Edition): The Official Script Book of the Original West End Production,medimops,Deutschland,3.63,12
9780751565362,Harry Potter and the Cursed Child - Parts One and Two: The Official Playscript of the Original West End Production,medimops,Deutschland,3.63,12
9780785136552,Daredevil: Born Again,Bookbot,Tschechien,69.4,12
9780817637958,Fractal Geometry in Architecture & Design,A Squared Books (Don Dewhirst),USA,56.93,12
9781405278454,The Adventures Of Tintin (Book Collection),BoundlessBookstore,Vereinigtes Königreich,68.73,12
9781408834992,Harry Potter and the Goblet of Fire,medimops,Deutschland,4.1,12
9781408841709,Harry Potter & The Deathly Hallows,medimops,Deutschland,4.23,12
9781408855669,Harry Potter 2 and the Chamber of Secrets,medimops,Deutschland,4.24,12
9781493218424,SAP S/4hana Management Accounting Certification Guide: Application Associate Exam,ThriftBooks-Dallas,USA,44.1,12
9781563673283,"The Practical Guide To Patternmaking For Fashion Designers: Juniors, Misses, And Women",Revaluation Books,Vereinigtes Königreich,60.28,12
9781844650262,Jean-Luc Nancy and the future of philosophy,Bookbot,Tschechien,67.5,12
9781848856264,Fortresses of the Intellect: Ismaili and Other Islamic Studies in Honour of Farhad Daftary,Midtown Scholar Bookstore,USA,41.5,12
9781870049443,Nine Inch Nails. A Tear Out Photo Book,Bookbot,Tschechien,67.9,12
9781913620561,The Devil is leaving his Cave,Phototitles Limited,Vereinigtes Königreich,40.52,12
9782070518425,Harry Potter à l'école des Sorciers,medimops,Deutschland,4.14,12
9782070524556,"Harry Potter, tome 2 : Harry Potter et la Chambre des secrets",medimops,Deutschland,3.63,12
9782070528189,"Harry Potter, tome 3 : Harry Potter et le Prisonnier d'Azkaban (Harry Potter (French))",medimops,Deutschland,3.86,12
9782070545803,"Rencontre avec J.K. Rowling, l'auteur de Harry Potter",medimops,Deutschland,3.44,12
9782070612376,Harry Potter 2 et la chambre des secrets (Folio Junior),medimops,Deutschland,4.38,12
9782070643035,Harry Potter 2 et la chambre des secrets,medimops,Deutschland,3.63,12
9782075074209,Harry Potter 8 : Harry Potter et l'enfant maudit,medimops,Deutschland,4.09,12
9783407364920,Handbuch Management in der Weiterbildung,Bookbot,Tschechien,68.71,12
9783527325108,Anatomie und Physiologie,Studibuch,Deutschland,23.31,12
9783531147239,Ausw?rtiges Amt: Diplomatie als Beruf (German Edition),SecondSale,USA,62.63,12
9783534270699,Christen im Nahen Osten: Zwischen Martyrium und Exodus,Studibuch,Deutschland,36.08,12
9783551359261,Harry Potter: Die Märchen von Beedle dem Barden / Wilharm: Ein Klassiker aus der Zaubererwelt von Harry Potter,medimops,Deutschland,4.38,12
9783551553027,"Harry Potter, Magisches Tagebuch (rot)",medimops,Deutschland,4.06,12
9783551553195,"Harry Potter, Taschenkalender (m. Filmfotos)",medimops,Deutschland,3.18,12
9783580634308,"Mentor Interpretationshilfe zu J. K. Rowling ""Harry Potter and the Philosopher's Stone"" - Personen Hintergrund Interpretation",medimops,Deutschland,3.95,12
9783662298114,"Lehrbuch der Ohren-, Nasen-, Rachen- und Kehlkopf-Krankheiten",moluna,Deutschland,54.99,12
9783775717786,Yearning for beauty,Bookbot,Tschechien,67.8,12
9783822857267,Leonardo da Vinci: Sämtliche Gemälde und Zeichnungen,Bookbot,Tschechien,68.52,12
9783841901903,So wenig Design wie möglich,Buchhandlung Steinbergerhof,Österreich,38.0,12
9783854152972,Beziehungsreicher Alltag,Bookbot,Tschechien,68.52,12
9783864060441,Ein Tropfen Zeit,Bookbot,Tschechien,69.36,12
9783867171212,Harry Potter 6 und der Halbblutprinz,medimops,Deutschland,4.02,12
9783895848339,Harry Potter und die Kammer des Schreckens. Bd. 2. 8 Cassetten,medimops,Deutschland,4.35,12
9783895848926,"Harry Potter und der Feuerkelch (Bd. 4), Cassetten, Teil 2",medimops,Deutschland,4.29,12
9783899102727,Meine Lieblingsrezepte,Bookbot,Tschechien,68.4,12
9783933928337,Der Herzkreis,Bookbot,Tschechien,69.11,12
9783937872162,Etymologisches Wörterbuch der botanischen Pflanzennamen,Versandantiquariat Bernd Keßler,Deutschland,24.0,12
9788020703675,Prague panoramic,Bookbot,Tschechien,67.9,12
9788080792244,Schülerduden. Die Geographie,Bookbot,Tschechien,1.5,12
9788375761627,Tatry,Bookbot,Tschechien,69.11,12
9780008325398,Sanditon: & Other Stories (Collins Classics),WorldofBooks,Vereinigtes Königreich,0.92,13
9780199596317,The Oxford Handbook of Philosophy of Mind (Oxford Handbooks),Prior Books Ltd,Vereinigtes Königreich,32.56,13
9780262610261,A Fortran Coloring Book,Easy Chair Books,USA,34.2,13
9780313289200,Cultural conflict and the Swedish sexual myth,Bookbot,Tschechien,65.5,13
9780943972480,Night of the Grizzlies,HPB Inc.,USA,22.13,13
9780945454212,The Hermeneutics of Sacred Architecture. Vol. 1,Bookbot,Tschechien,66.3,13
9780991638611,Advanced WebLogic Server Automation: Administration and Monitoring with WLST and JMX (Oracle In-Focus Series),Isle Books,USA,23.24,13
9780993090899,The Supermarine Swift: A Technical Guide (Airframe Detail #4).,Decal Supply Corps,USA,18.94,13
9781581606881,Sigmund Ringeck's Knightly Art of the Longsword,2nd Life Books,USA,62.49,13
9781844165360,Legion (The Horus Heresy): No. 7,WeBuyBooks,Vereinigtes Königreich,29.97,13
9783446459113,Programmieren trainieren,Bookbot,Tschechien,65.36,13
9783447062992,Hellmuth Felmy,Bookbot,Tschechien,66.9,13
9783662553220,Gesteinskunde: Ein Leitfaden für Einsteiger und Anwender,Revaluation Books,Vereinigtes Königreich,57.3,13
9783701705658,Architektur ohne Architekten,Bookbot,Tschechien,65.9,13
9783716509456,H. A. Sigg. Vitraux et peinture. Le Temple réformé de Fribourg. Farbfenster und Malerei. Reformierte Kirche Freiburg.,Bookbot,Tschechien,65.4,13
9783766718259,Das Farbwo?rterbuch,Bookbot,Tschechien,66.0,13
9783775709675,Erich Wonder: Stage Design,SecondSale,USA,46.46,13
9783854470083,"Café Hawelka, ein Wiener Mythos",Bookbot,Tschechien,65.6,13
9783854474852,Ferdinand Georg Waldmu?ller,Bookbot,Tschechien,66.7,13
9783859950832,Die Bibel. Heilige Schrift des Alten und des Neuen Testaments,Bookbot,Tschechien,9.9,13
9783896026095,Lindenstraße. 1000 Folgen in Text und Bild.,Neusser Buch & Kunst Antiquariat,Deutschland,50.0,13
9783898123440,"Berlin, mit Bitte um Weisung",Bookbot,Tschechien,66.8,13
9783898805551,"Das Original Porsche 924, 944, 968",Bookbot,Tschechien,65.45,13
9783898805742,Lamborghini,Bookbot,Tschechien,66.8,13
9783899392135,Living 2019/2020 (English and German Edition) [Hardcover ],booksXpress,USA,22.07,13
9783901753312,Ein Garten fu?r das 21. Jahrhundert,Bookbot,Tschechien,65.4,13
9783902406781,"Ich weiß es nicht, wohin die Engel fliegen ."". Lieder und Texte.",Buchhandlung Gerhard Höcher,Österreich,16.8,13
9783950061208,Kunstlexikon,Bookbot,Tschechien,65.7,13
9783980114905,Beitra?ge zur Genese des germanischen Buntsandsteins,Bookbot,Tschechien,65.8,13
9788090332843,Czech Republic,AwesomeBooks,Vereinigtes Königreich,39.92,13
9789004424661,The East Asian Modern Girl,Bookbot,Tschechien,65.9,13
9780007180561,Green Eggs and Ham and Other Stories Jigsaw Book (Dr Seuss Jigsaw Book),Brit Books,Vereinigtes Königreich,59.33,14
9780195305920,Did Dogen Go to China?: What He Wrote and When He Wrote It,Anybook.com,Vereinigtes Königreich,59.07,14
9780241292525,The Order of Time,WorldofBooks,Vereinigtes Königreich,38.45,14
9780521606738,Ship Or Sheep? Book And Audio Cd Pack: An Intermediate Pronunciation Course,Hamelyn,Spanien,4.74,14
9780958280921,Eyebody,Bookbot,Tschechien,47.6,14
9781292214290,"Operating Systems: Internals and Design Principles, Global Edition",College Books Shop,USA,60.97,14
9781416402329,Children with Autism Spectrum Disorders,Bookbot,Tschechien,65.2,14
9781444941944,How To Train Your Dragon Collection - 10 Books,WeBuyBooks,Vereinigtes Königreich,30.02,14
9781506707464,God of War,Goodwill Books,USA,49.66,14
9781621005117,Soil Amino Acids,PBShop.store UK,Vereinigtes Königreich,51.57,14
9781902109350,Early Soviet Jet Fighters,suffolkbooks,USA,34.97,14
9781933578903,"FYI: For Your Improvement - Competencies Development Guide, 6th Edition",tttkelly1,USA,50.28,14
9782917781685,TRAVEL BOOK PARIS (Dutch Edition),Gallix,Frankreich,55.0,14
9783000091735,Aktien a? la carte,Bookbot,Tschechien,64.2,14
9783030024611,"(Almost) Impossible Integrals, Sums, and Series",AHA-BUCH GmbH,Deutschland,45.65,14
9783100870162,Cahiers. Hefte 6,Bookbot,Tschechien,64.9,14
9783351036607,Das ist unser Haus,Bookbot,Tschechien,64.39,14
9783404143368,DER HEXER-ZYKLUS.,INFINIBU KG,Deutschland,7.57,14
9783422073326,Nürnberg als Kunstzentrum des Heiligen Römischen Reiches,Bookbot,Tschechien,64.7,14
9783426522066,Peripherie: Roman,medimops,Deutschland,15.29,14
9783446124257,Geschichte der Eisenbahnreise,Bookbot,Tschechien,64.0,14
9783517012841,Bentley Continental R,Bookbot,Tschechien,63.9,14
9783636013293,"Strategy Safari. Eine Reise durch die Wildnis des strategischen Managements Manager Magazin Edition [Hardcover] Strategie Safari Ökonomie Wirtschaftswissenschaften BWL Betriebswirtschaft Unternehmen Stragtegisches Management Strategie-Diskussion Strategie-Entwicklung Strategisches Management Beruf Finanzen Wirtschaft Henry Mintzberg (Autor), Bruce Ahlstrand (Autor), Joseph Lampel (Autor)",BUCHSERVICE / ANTIQUARIAT Lars Lutzer,Deutschland,59.95,14
9783642204838,How lawyers think,Bookbot,Tschechien,65.3,14
9783704604095,Wiener Blut oder Die Ehre der Strizzis,Bookbot,Tschechien,65.36,14
9783795429461,Bavaria. Land at the heart of Europe,Berliner Büchertisch eG,Deutschland,29.99,14
9783836292542,React: Das umfassende Handbuch für moderne Frontend-Entwicklung. Mit vielen Praxisbeispielen ? Neue Ausgabe 2023,Studibuch,Deutschland,44.68,14
9783836449168,How Corporate Culture is Influenced by National Culture - Using the Example of South Korea and Samsung,Lucky's Textbooks,USA,48.15,14
9783850284462,Osttirol,Bookbot,Tschechien,65.3,14
9783850580229,Isaak Moscheles,Book Broker,Deutschland,61.99,14
9783874399074,Branded Interactions: Lebendige Markenerlebnisse für eine neue Zeit,Studibuch,Deutschland,58.37,14
9783899192292,Klimt,Bookbot,Tschechien,64.07,14
9783924696832,Astoria. Aus dem Englischen. 3 in 1 Bd. (Nachdruck der Originalausgabe Frankfurt 1837).,Matthaeus Truppe Antiquariat,Österreich,58.8,14
9783929305975,Schnittkonstruktionen Haka Grundwissen,Bookbot,Tschechien,65.0,14
9783936314441,"Kisho Kurokawa, Metabolism and symbiosis, Metabolismus und Symbiosis",Bookbot,Tschechien,64.9,14
